{
  "accepted": true,
  "adjudicated": false,
  "adjudication_reasons": [],
  "classification": "faithful-equivalent",
  "completed_at_utc": "2026-08-20T13:20:18.709724+00:00",
  "findings": [],
  "implications": {
    "lean_implies_paper": {
      "reasoning": "Under the paper's nonsingular real square system and nonzero right-hand side, all Lean definitions unfold to the displayed perturbation set and normalized residual. IsLeast therefore yields exactly the paper's minimum identity for x_hat.",
      "verdict": "yes"
    },
    "paper_implies_lean": {
      "reasoning": "The paper's exact minimum identity entails that the normalized residual is admissible and no larger than every admissible epsilon, which is precisely IsLeast. Valid Lean instances have the paper's finite real dimensions; the syntactic n=0 case has an impossible b != 0 premise.",
      "verdict": "yes"
    }
  },
  "judge_classifications": {
    "direct": "faithful-equivalent",
    "roundtrip": "faithful-equivalent"
  },
  "rationale": "The Lean proposition is an exact formal rendering of the selected Section 2 normwise backward-error characterization. Its matrix and vector spaces, nonsingularity and nonzero hypotheses, simultaneous existential perturbations, Frobenius and vector 2-norms, common epsilon, residual orientation, denominator, and minimum semantics all agree with the hash-verified PDF. The generic treatment of xHat matches the paper's algorithm-independent definition, and the statement is nonvacuous.",
  "remaining_uncertainties": [],
  "role": "final-decision",
  "schema_version": "highambench-faithfulness-0.2",
  "task_id": "P16-T1"
}
