{
  "accepted": false,
  "adjudicated": true,
  "adjudication_reasons": [
    "direct judge requested adjudication",
    "round-trip judge requested adjudication",
    "direct D003 is unclear",
    "direct D006 is unclear",
    "direct D008 is unclear",
    "direct D029 is unclear",
    "direct D030 is unclear",
    "direct D031 is unclear",
    "direct D032 is unclear",
    "direct S09 is unclear",
    "round-trip S09 is unclear"
  ],
  "classification": "not-faithful-different",
  "completed_at_utc": "2026-08-13T19:32:53.581175+00:00",
  "findings": [
    {
      "category": "claim-substitution",
      "evidence": "PDF pages 17-18 attach the two error regimes to the four-stage Method 4s3pC with explicitly printed A, A^epsilon, b, and b^epsilon coefficients. The formal statement mentions none of these and defines its error vectors directly from arbitrary inputs.",
      "impact": "The formal theorem is an elementary vector-norm result, not a result about execution or convergence of Method 4s3pC.",
      "severity": "critical"
    },
    {
      "category": "asymptotic-semantics",
      "evidence": "PDF page 18 states big-O global error forms with hidden constants. Lean instead gives exact unit-constant inequalities throughout 0 <= h <= 1 and uses no eventual quantifier, remainder, or uniformity condition.",
      "impact": "The relations have different mathematical meanings, preventing either semantic implication.",
      "severity": "major"
    },
    {
      "category": "regime-and-hypotheses",
      "evidence": "PDF pages 6, 8, and 18 separate bounded-derivative well-behaved tau from non-Lipschitz chopping, and page 2 qualifies global-error expectations by stability. Lean asserts both constructions simultaneously under only bounds on h and epsilon.",
      "impact": "The central smooth-versus-nonsmooth distinction and the assumptions justifying the global orders are absent.",
      "severity": "major"
    },
    {
      "category": "unsupported-norm-and-dimension",
      "evidence": "PDF pages 18-19 do not specify a norm, normalization, dimension, or coordinate set. Lean fixes an Euclidean norm on arbitrary Fin n vectors.",
      "impact": "This is a genuine but non-pivotal source ambiguity, not evidence of a conflicting norm or dimension.",
      "severity": "minor"
    },
    {
      "category": "extra-comparison",
      "evidence": "The paper gives separate big-O regimes with unspecified constants and does not order their bounds. Lean adds an exact inequality comparing the smooth and nonsmooth right-hand sides.",
      "impact": "The additional conjunct is not part of the source claim and cannot be inferred by comparing big-O expressions with unrelated hidden constants.",
      "severity": "minor"
    }
  ],
  "implications": {
    "lean_implies_paper": {
      "reasoning": "The Lean theorem proves exact triangle-type inequalities for vectors defined to equal h^3 times an arbitrary scheme vector plus epsilon h^k times an arbitrary perturbation vector. It contains no Method 4s3pC coefficients or stages, F or F^epsilon, tau regularity, stability, numerical trajectory, global forward error, or asymptotic witnesses. It therefore cannot establish either paper regime, regardless of whether the paper's unspecified norm could be Euclidean.",
      "verdict": "no"
    },
    "paper_implies_lean": {
      "reasoning": "The paper's coefficient-specific, stability-qualified big-O envelopes for actual global error do not assert exact unit-constant inequalities for every arbitrary Fin n vector and every h in [0,1], do not define error as the formal vector sums, and do not compare the two regime bounds by the formal third conjunct. The formal inequalities are independently true algebraic facts, not the semantic consequence expressed by the paper.",
      "verdict": "no"
    }
  },
  "judge_classifications": {
    "direct": "not-faithful-different",
    "roundtrip": "not-faithful-different"
  },
  "rationale": "The inspected reference PDF has SHA-256 b18628ffc348d7aeec2da02efb989b6e012f0b0fae09b27fbff735bb8a5877cd. It decisively identifies a coefficient-specific, stability-qualified, regularity-dependent global-error claim for Method 4s3pC. The formal declaration instead proves universally valid Euclidean triangle inequalities for exact surrogate vectors, with the desired powers inserted by definition. The PDF's silence about norm and dimension leaves those specializations unsupported rather than contradictory, but even granting them does not restore the algorithm, hypotheses, error notion, or asymptotic semantics. Neither implication holds, so not-faithful-different is the required classification.",
  "remaining_uncertainties": [
    "The PDF does not determine whether the theoretical or Figure 6 Error uses an Euclidean 2-norm, another norm, or a different normalization. Thus the formal Euclidean norm is unsupported but not contradicted.",
    "The PDF does not specify a state-error dimension or coordinate index set. A finite-dimensional realization may be compatible with a spatial discretization, but arbitrary Fin n vectors, including n = 0, are not sourced.",
    "Neither uncertainty affects the implication verdicts or classification because the missing algorithm linkage, separate regime hypotheses, stability qualification, actual error object, and big-O semantics remain decisive under any compatible norm or finite dimension."
  ],
  "role": "final-decision",
  "schema_version": "highambench-faithfulness-0.2",
  "task_id": "P18-T3"
}
