{
  "accepted": false,
  "adjudicated": true,
  "adjudication_reasons": [
    "direct judge requested adjudication"
  ],
  "classification": "not-faithful-different",
  "completed_at_utc": "2026-08-13T16:29:09.215492+00:00",
  "findings": [
    {
      "category": "derived-exactness-assumed",
      "evidence": "Printed p. 397 derives the exact FastTwoSum residual identity and representability of the final exact sum. In the declaration, hmergeTMem, hmergeRMem, and hfinalMem combined with p12Nearest force these equalities.",
      "impact": "The paper's central numerical argument is reduced to real-algebra bookkeeping.",
      "severity": "critical"
    },
    {
      "category": "algorithm-linkage-missing",
      "evidence": "Printed pp. 395-396 prescribe three TwoProduct calls, FastTwoSum, and a final floating-point addition. P12ThreeProductTrace can be constructed from any ten reals and has no execution invariant.",
      "impact": "The declaration does not establish a property of an actual ThreeProduct execution.",
      "severity": "major"
    },
    {
      "category": "floating-point-contract-omitted",
      "evidence": "The PDF defines one system F with radix, precision, exponent bounds, rounding operations, and range conditions. The declaration uses only an arbitrary predicate on Real and does not require most inputs or intermediates to satisfy it.",
      "impact": "The source's range-dependent floating-point claim cannot be recovered from the formal statement.",
      "severity": "major"
    },
    {
      "category": "two-product-semantics-omitted",
      "evidence": "Equation (17) identifies th as the computed rounded product, gives the exact high-plus-low identity, and bounds the low term by one-half ulp; corresponding contracts govern the other TwoProduct calls. The declaration retains only three arbitrary exact decompositions.",
      "impact": "Traces that could not arise from TwoProduct satisfy the declaration.",
      "severity": "major"
    },
    {
      "category": "source-range-clarified",
      "evidence": "Printed p. 391 explicitly establishes absence of overflow as a standing Section 4 assumption, while Lemma 4 on printed p. 396 separately excludes underflow errors in FourSumThreeProduct.",
      "impact": "The source-range wording does not create an implication ambiguity and does not change the classification.",
      "severity": "note"
    }
  ],
  "implications": {
    "lean_implies_paper": {
      "reasoning": "Applying the Lean theorem to the paper's procedure would first require an execution link and proofs that the actual outputs satisfy the three TwoProduct decompositions, exact-subtraction representability premises, and final-sum representability premise. Those are the principal numerical obligations proved on printed pp. 396-397, and the declaration supplies none of them.",
      "verdict": "no"
    },
    "paper_implies_lean": {
      "reasoning": "Lemma 4 concerns outputs generated by ThreeProduct in the particular floating-point system F under the standing no-overflow and stated no-underflow-error conditions. It does not establish the declaration's universal conditional for every predicate on the reals and every freely constructed real trace.",
      "verdict": "no"
    }
  },
  "judge_classifications": {
    "direct": "not-faithful-different",
    "roundtrip": "not-faithful-different"
  },
  "rationale": "The verified PDF context resolves the no-overflow issue: it is a standing Section 4 assumption. The declaration exactly reproduces equation (18) only after replacing the paper's floating-point execution and range hypotheses with arbitrary real decompositions and assumptions that force the difficult residual operations to be exact. Its broader quantifiers are therefore not genuine, nonvacuous theorem strength. Since it neither proves the source algorithm satisfies its antecedents nor follows as a universal statement from Lemma 4, both implication directions fail and the appropriate classification is not-faithful-different.",
  "remaining_uncertainties": [
    "The PDF does not formally define whether the phrase 'absence of underflow errors' permits every exact operation in the underflow or subnormal range. This does not affect the adjudication because the declaration models no underflow behavior and assumes the required exact-result representability directly."
  ],
  "role": "final-decision",
  "schema_version": "highambench-faithfulness-0.2",
  "task_id": "P12-T3"
}
