{
  "accepted": true,
  "adjudicated": true,
  "adjudication_reasons": [
    "judge classifications differ",
    "direct judge requested adjudication",
    "direct S14 is unclear"
  ],
  "classification": "faithful-stronger",
  "completed_at_utc": "2026-08-20T09:21:26.271937+00:00",
  "findings": [
    {
      "category": "task-scope",
      "evidence": "Equation (3.3) is the final aggregate sum result, and the declaration's Delta, envelope, and remainder are explicitly organized around that result.",
      "impact": "Intermediate page-2317 inequalities provide supporting context but are not all mandatory conclusions of P14-T1.",
      "severity": "note"
    },
    {
      "category": "intermediate-weighted-bounds",
      "evidence": "The target's unweighted gamma_{n-1} bound is first-order looser on later terms than the paper's position-dependent accumulation bound.",
      "impact": "The target must not be described as reproducing every intermediate bound, although this does not affect faithfulness to equation (3.3).",
      "severity": "minor"
    },
    {
      "category": "printed-missing-u",
      "evidence": "The final line of equation (3.2) omits u, while its preceding line and equation (3.3) contain the required first-order u scaling.",
      "impact": "The omission is treated as a typographical defect; no literal-equivalence claim for that malformed line is accepted.",
      "severity": "note"
    },
    {
      "category": "explicit-remainder-strength",
      "evidence": "The declaration replaces the unspecified aggregate O(u^2) allowance with an exact finite envelope and a specific rational remainder proved to be O(u^2).",
      "impact": "This is substantive, nonvacuous extra strength and makes the converse implication fail.",
      "severity": "note"
    }
  ],
  "implications": {
    "lean_implies_paper": {
      "reasoning": "Map exactSum to s, p14RecursiveComputedExpSum to hat(s), and p14BasicSumDelta to Delta s. The target gives hat(s)=s+Delta s and eventually bounds |Delta s| by an envelope equal to (n+1)u*s+R, with R=O(u^2). This directly yields the coherent and literally printed equation (3.3). The different gamma accumulation clause does not obstruct this aggregate implication.",
      "verdict": "yes"
    },
    "paper_implies_lean": {
      "reasoning": "Equation (3.3) and its surrounding first-order analysis leave O(u^2) unspecified. They do not state the target's exact gamma_{n-1} accumulation inequality, exact rational finite envelope, particular remainder n(n+1)s*u^2/(1-nu), or arbitrary-filter formulation. Those additional conclusions therefore are not supplied by the paper statement.",
      "verdict": "no"
    }
  },
  "judge_classifications": {
    "direct": "not-faithful-different",
    "roundtrip": "faithful-stronger"
  },
  "rationale": "Primary PDF evidence makes equation (3.3) an unambiguous coherent aggregate claim despite the missing-u typo in the preceding equation. The declaration preserves the unshifted exponential computation, exact/computed-sum distinction, left-to-right addition model, componentwise exponential errors, additive Delta s identity, and the (n+1)u*s first-order bound. Its gamma accumulation clause does not reproduce the sharper intermediate coefficient distribution, but those displays are derivation context rather than the scoped benchmark result. The explicit finite envelope and quadratic remainder genuinely strengthen equation (3.3) without reducing applicability or creating vacuity. Therefore Lean implies the scoped paper claim, the paper does not imply all added Lean conclusions, and the correct classification is faithful-stronger.",
  "remaining_uncertainties": [
    "Equation (3.1) reuses an unindexed delta_1, so the PDF does not explicitly decide between one common error and separate local errors. The target's per-index bounded errors match the conventional componentwise reading and include the common-error case.",
    "The paper gives no constant, parameter dependence, or finite-u range for its O(u^2) term. The target's explicit remainder is therefore a valid witness for equation (3.3), but it cannot be identified as the paper's uniquely intended remainder."
  ],
  "role": "final-decision",
  "schema_version": "highambench-faithfulness-0.2",
  "task_id": "P14-T1"
}
