{
  "accepted": true,
  "adjudicated": true,
  "adjudication_reasons": [
    "judge classifications differ"
  ],
  "classification": "faithful-stronger",
  "completed_at_utc": "2026-08-21T16:20:09.984128+00:00",
  "findings": [
    {
      "category": "source-licensed-intermediate-certificate",
      "evidence": "D041's sibling bound is equation (2.4), and D032 links the completed trace to the actual numerator and the required aggregate exact and absolute sums.",
      "impact": "The trace does not preload (4.3) and does not narrow applicability to paper-valid executions.",
      "severity": "note"
    },
    {
      "category": "algorithm-representation",
      "evidence": "Printed page 694 explicitly identifies Doolittle as one mathematically equivalent formulation sufficient for the analysis.",
      "impact": "DoolittleRun is a licensed representation of the selected result rather than an unsupported algorithm specialization.",
      "severity": "note"
    },
    {
      "category": "broader-format-domain",
      "evidence": "D019 permits sparse finite representable sets and an abstract safeRange while retaining the local rounding laws and certificates needed by the theorem.",
      "impact": "The formal declaration proves a nonvacuous extension beyond the paper's stated standard-format domain, making it faithful-stronger rather than equivalent.",
      "severity": "minor"
    }
  ],
  "implications": {
    "lean_implies_paper": {
      "reasoning": "A paper-standard round-to-nearest format instantiates D019; every completed exception-free Doolittle evaluation supplies D032's tree data, and equation (2.4) constructs its protected trace. The PDF explicitly licenses Doolittle as a mathematically equivalent representative, so the Lean local and global conclusions specialize to Theorem 4.2 and equations (4.2)-(4.3).",
      "verdict": "yes"
    },
    "paper_implies_lean": {
      "reasoning": "The paper quantifies over its standard finite floating-point set F, whereas D019 admits additional inhabited sparse representable sets and abstract safe ranges. The certificate-bearing 2-by-2 example has nonzero error and rounding behavior unavailable in the corresponding full paper format, so the extra formal domain is genuine.",
      "verdict": "no"
    }
  },
  "judge_classifications": {
    "direct": "not-faithful-weaker",
    "roundtrip": "faithful-equivalent"
  },
  "rationale": "The direct judgment correctly noticed that the trace is not structurally indexed by the actual sum tree and that the format record has extra models, but it incorrectly treated both facts as reduced applicability. Equation (2.4) is an explicit prior source result used inside the proof of Theorem 3.1, and every paper-valid tree can furnish the required trace. The trace assumes only those sibling bounds, not Lemma 4.1 or (4.3). Likewise, the paper explicitly licenses Doolittle as a sufficient mathematically equivalent formulation. Consequently the Lean theorem covers the paper result. Its abstract format additionally supports inhabited, certificate-bearing sparse models with substantive nonzero residuals that are not instances of the paper's full F. That extra universal domain prevents the converse implication and yields the accepted classification faithful-stronger.",
  "remaining_uncertainties": [
    "The selected paper passage does not enumerate all Gaussian-elimination variants or specify pivoting. The equivalence determination is therefore limited to the unpermuted mathematically equivalent formulations expressly invoked on printed page 694; it does not extend the target to arbitrary pivoted algorithms."
  ],
  "role": "final-decision",
  "schema_version": "highambench-faithfulness-0.2",
  "task_id": "P05-T2"
}
