{
  "accepted": true,
  "adjudicated": true,
  "adjudication_reasons": [
    "judge classifications differ",
    "round-trip judge requested adjudication",
    "round-trip judge classification is undetermined",
    "round-trip S02 is unclear",
    "round-trip S04 is unclear",
    "round-trip S15 is unclear"
  ],
  "classification": "faithful-equivalent",
  "completed_at_utc": "2026-08-21T10:14:28.274481+00:00",
  "findings": [
    {
      "category": "derived-conclusions",
      "evidence": "The target has no separate conjunct for the finite perturbation inequality or attaining witness, but both follow exactly from D003, D010, D014, and D015 by the argument printed in Lemma 2.2.",
      "impact": "There is no semantic weakening, although separate Lean corollaries could make these consequences easier to discover.",
      "severity": "note"
    },
    {
      "category": "source-sign-typo",
      "evidence": "The proof on printed p. 548 writes the signed output difference with the opposite sign from equation (2.1). D015 uses the algebraically correct subtraction and then absolute value.",
      "impact": "The typo affects neither the condition number, finite inequality, attaining magnitude, nor either implication direction.",
      "severity": "note"
    }
  ],
  "implications": {
    "lean_implies_paper": {
      "reasoning": "The first Lean conjunct identifies the positive-radius perturbation supremum with sum_j |ell_j f_j|/|p_f(x)|, and the second gives the lower bound 1. Unfolding D010, D014, and D015 yields the paper's finite inequality for every admissible perturbation. For epsilon > 0, the paper's sign-aligned Delta f is admissible and makes every nonzero summand have the same sign, so it attains the quotient. Thus all selected paper claims follow on the same nonzero-value domain.",
      "verdict": "yes"
    },
    "paper_implies_lean": {
      "reasoning": "The paper's n+1 distinct real nodes, data, and fixed evaluation point package directly into D001 and D007. Equation (2.1) agrees with D005, D006, D010, and D011. Definition 2.1, read through positive perturbation radii, agrees with D004 and D012-D015, while equation (2.2) gives D003 as its limit and proves 1 <= D003. The attainable sets are nonempty and bounded for positive epsilon, so Lean's totalized sSup fallback is irrelevant.",
      "verdict": "yes"
    }
  },
  "judge_classifications": {
    "direct": "faithful-equivalent",
    "roundtrip": "undetermined"
  },
  "rationale": "Primary PDF evidence and the complete declaration semantics establish the same exact real interpolation problem, componentwise perturbation model, relative output error, limiting supremum, closed-form condition number, and lower bound. The disputed finite bound and attainment are genuine consequences of the Lean domain and definitions, not independent assumptions missing from the proposition. The real scalar setting is supported by the paper's sign witness and surrounding floating-point context, while the right-sided limit merely formalizes epsilon's role as a perturbation radius. Both implication directions hold without reduced applicability or vacuity; for example, the one-node problem with nonzero data satisfies the hypotheses and has condition number 1.",
  "remaining_uncertainties": [],
  "role": "final-decision",
  "schema_version": "highambench-faithfulness-0.2",
  "task_id": "P13-T1"
}
