{
  "accepted": false,
  "adjudicated": true,
  "adjudication_reasons": [
    "round-trip judge requested adjudication"
  ],
  "classification": "not-faithful-weaker",
  "completed_at_utc": "2026-08-13T19:05:48.508136+00:00",
  "findings": [
    {
      "category": "probabilistic-conclusion-removed",
      "evidence": "The paper bounds E[product_k(1+delta_k)], whereas D004 and the elaborated target form the exact deterministic Finset product with no expectation dependency.",
      "impact": "The declaration proves an interval-product lemma, not the paper's accumulated stochastic-bias envelope.",
      "severity": "critical"
    },
    {
      "category": "wrong-error-variable-and-hypotheses",
      "evidence": "The paper bounds |beta_k| and relates delta_k to beta_k through unconditional and conditional expectations. The declaration has no beta family and instead assumes |delta(i)|<=B pointwise.",
      "impact": "The declaration applies only to a restricted deterministic regime and cannot model the paper's random errors with larger pathwise excursions.",
      "severity": "critical"
    },
    {
      "category": "limited-precision-rounding-linkage-omitted",
      "evidence": "PDF pages 6-10 define SR_{p,r}, fl_{p+r}, and B=u_{p+r}; the declaration contains only real scalars and generic B.",
      "impact": "Using B=u_{p+r} would require the SR output errors themselves to be bounded by u_{p+r}, which the paper does not assert.",
      "severity": "major"
    },
    {
      "category": "paper-positivity-gap",
      "evidence": "The printed induction multiplies inequalities by Q_{n-1} and 1-B without hypotheses ensuring their nonnegativity; the stated counterexample violates its conclusion.",
      "impact": "The abstract paper theorem is not valid literally as printed, although its intended SR specialization can supply the missing positivity.",
      "severity": "major"
    },
    {
      "category": "boundary-domain-changes",
      "evidence": "The paper uses a positive operation count and B>0 without B<=1, while Lean permits n=0 and B=0 but requires B<=1.",
      "impact": "These elementary boundary changes further confirm specialization rather than equivalence.",
      "severity": "minor"
    }
  ],
  "implications": {
    "lean_implies_paper": {
      "reasoning": "The Lean declaration says nothing about random delta values that are controlled only through bounded conditional means beta. It cannot derive an expectation-after-product result or the SR_{p,r} specialization. The explicit two-outcome counterexample also shows that the paper's literal abstract conclusion does not follow from its printed hypotheses, while its unbounded delta_1 lies outside the declaration's reduced domain.",
      "verdict": "no"
    },
    "paper_implies_lean": {
      "reasoning": "At the level of the paper's claimed theorem schema, every Lean instance with n>=1 and 0<B<=1 embeds nonvacuously into a singleton probability space by setting paper delta_k=paper beta_k=Lean delta(k-1). Expectations and conditional expectations then equal those constants, the beta bound is exactly the Lean delta bound, and the paper conclusion becomes the Lean product bound. The n=0 and B=0 cases follow directly from the empty-product and zero-perturbation identities.",
      "verdict": "yes"
    }
  },
  "judge_classifications": {
    "direct": "not-faithful-weaker",
    "roundtrip": "not-faithful-weaker"
  },
  "rationale": "The endpoint powers, exponent n, inequality directions, and conjunction agree, but the mathematical object and assumptions do not. The paper claim structurally yields the declaration through constant random variables, while the declaration cannot recover the paper's conditional stochastic statement. The target is satisfiable and nontrivial, yet its apparent pathwise strength comes solely from stronger assumptions and reduced applicability. Therefore the compatible implication pattern is lean-to-paper no and paper-to-lean yes, giving not-faithful-weaker and accepted=false.",
  "remaining_uncertainties": [
    "The PDF does not specify the intended repair to the abstract Theorem 3.6: it could explicitly require nonnegative accumulated factors and B<=1, or restrict the theorem to actual SR_{p,r} errors that inherit those properties. Either repair leaves the declaration unfaithful because it still omits expectation, beta variables, conditional means, and the radius B=u_{p+r}."
  ],
  "role": "final-decision",
  "schema_version": "highambench-faithfulness-0.2",
  "task_id": "P17-T1"
}
