{
  "accepted": false,
  "adjudicated": true,
  "adjudication_reasons": [
    "judge classifications differ",
    "direct judge requested adjudication",
    "round-trip judge requested adjudication",
    "round-trip judge classification is undetermined",
    "blind dependency D026 is unclear",
    "blind dependency D040 is unclear",
    "blind dependency D041 is unclear",
    "direct D001 is unclear",
    "direct D004 is unclear",
    "direct D006 is unclear",
    "direct D013 is unclear",
    "direct D051 is unclear",
    "direct S14 is unclear",
    "direct S15 is unclear",
    "round-trip S03 is unclear",
    "round-trip S06 is unclear"
  ],
  "classification": "not-faithful-weaker",
  "completed_at_utc": "2026-08-21T18:49:40.072399+00:00",
  "findings": [
    {
      "category": "improper conditionalization",
      "evidence": "The paper proves Theorem 1(a) before the selected page-768 corollary. Lean instead binds a `P09TheoremOneRmsAsymptotic` record, and no target dependency proves that record exists from the operational family.",
      "impact": "The target establishes only an algebraic conversion of an assumed forward estimate and excludes source-admissible executions for which no separate certificate is supplied.",
      "severity": "critical"
    },
    {
      "category": "remainder uniformity",
      "evidence": "The paper's finite expansion has bounded theta values and supports a worst-case higher-order bound for fixed algorithmic data. Lean permits the coefficient to be selected after the full input/model/run family.",
      "impact": "Even apart from certificate existence, the target does not preserve the natural path-uniform strength of the source derivation.",
      "severity": "major"
    },
    {
      "category": "source selection",
      "evidence": "The locator selects `e = T delta` and the two following norm bounds; the least-significant-digit sentence follows afterward in the same paragraph.",
      "impact": "The target does not omit a selected conclusion by leaving out that informal heuristic.",
      "severity": "note"
    },
    {
      "category": "core fidelity",
      "evidence": "The complete declaration evidence resolves the positive character sign and shows exact factorization, linked rounded stages, exact input, correct K and alpha cases, scaled RMS, and the correct maximum-norm conversion.",
      "impact": "There is no independent sign, normalization, norm, factor, inequality-direction, error-notion, or global-vacuity defect.",
      "severity": "note"
    }
  ],
  "implications": {
    "lean_implies_paper": {
      "reasoning": "Lean proves the backward conclusions only after an entire execution family and a `P09TheoremOneRmsAsymptotic` proof are supplied. No target dependency establishes that certificate for every source-admissible FFT family. This added antecedent reduces applicability; family-dependent remainder witnesses also do not recover the paper's bounded-theta worst-case uniformity.",
      "verdict": "no"
    },
    "paper_implies_lean": {
      "reasoning": "Under standard local big-O semantics, the paper's proved Theorem 1(a) supplies a coefficient and radius for corresponding asymptotic executions. Positive-sign Fourier invertibility and RMS scaling produce the epsilon-indexed fictional perturbation, and the finite-dimensional max-versus-RMS inequality yields the second bound. The paper's result therefore instantiates the target's weaker supplied certificate.",
      "verdict": "yes"
    }
  },
  "judge_classifications": {
    "direct": "not-faithful-weaker",
    "roundtrip": "undetermined"
  },
  "rationale": "Standard mathematical `O(epsilon^2)` semantics justifies a fixed epsilon-indexed family, a coefficient and radius chosen before epsilon, and an epsilon-indexed perturbation obtained by choice or Fourier inversion. The local declaration also conclusively supplies the positive Fourier sign. The source-selected result is only the backward identity and two bounds, and the operational, numerical-interface, norm, constant, and error-notion details otherwise match. The decisive proposition-level defect is that Lean assumes `P09TheoremOneRmsAsymptotic` rather than proving its existence from the modeled FFT, while the paper proves Theorem 1(a) and then derives the corollary. Thus paper implies Lean, Lean does not imply paper, the classification is not-faithful-weaker, and accepted is false.",
  "remaining_uncertainties": [
    "The PDF never states the complete dependency set or quantifier order for the hidden `O(epsilon^2)` coefficient and radius. Its finite bounded-theta proof supports independence from epsilon and uniformity over theta realizations for fixed structural data, but intended uniformity across all inputs, algorithm variants, or implementations is not explicitly specified."
  ],
  "role": "final-decision",
  "schema_version": "highambench-faithfulness-0.2",
  "task_id": "P09-T2"
}
