{
  "accepted": true,
  "adjudicated": false,
  "adjudication_reasons": [],
  "classification": "faithful-stronger",
  "completed_at_utc": "2026-08-20T17:38:51.174976+00:00",
  "findings": [
    {
      "category": "model-generalization",
      "impact": "The Lean result has a wider valid execution-model domain while retaining every paper instance, so it is faithfully stronger rather than merely equivalent.",
      "lean_evidence": "D011 records theorem-relevant bounds and conditional-mean properties but does not require the Bernoulli enclosing-value law.",
      "paper_evidence": "B1239 defines hat_y through actual SR_{p,r} rounded additions.",
      "severity": "note"
    },
    {
      "category": "implicit-nonzero-domain",
      "impact": "Lean makes the paper's necessary well-definedness condition explicit and excludes only the undefined zero-sum reading.",
      "lean_evidence": "The theorem requires p17ExactSum run.a != 0.",
      "paper_evidence": "Both kappa(a) in (4.2) and the relative bias in (4.6) divide by |y| without an explicit y!=0 hypothesis.",
      "severity": "note"
    },
    {
      "category": "numerical-model-generalization",
      "impact": "The translated theorem applies to a strict superset of the paper's executions. Actual paper executions instantiate it, so this is a faithful strengthening rather than a weaker or different conclusion.",
      "paper_evidence": "SR_{p,r} is a specific Bernoulli rounding operator returning one of two enclosing precision-p floating-point values with probabilities computed from fl_{p+r}.",
      "severity": "major",
      "translation_evidence": "An admissible run may use arbitrary real perturbations and probabilities provided the stated bounds and history-moment identities hold."
    },
    {
      "category": "truncation-linkage",
      "impact": "The translation does not reconstruct the concrete floating-point operation; T is largely auxiliary. This contributes to the strict abstraction but does not invalidate the bound.",
      "paper_evidence": "The paper defines beta from the specific p+r-bit directed-rounding function fl_{p+r} applied to each pre-rounding sum.",
      "severity": "minor",
      "translation_evidence": "T is otherwise arbitrary, is constrained only at encountered q_k values, and is not required to generate the delta-driven computed output."
    },
    {
      "category": "nonzero-domain",
      "impact": "This makes the ordinary real-valued domain explicit and does not alter the meaningful cases of the paper statement.",
      "paper_evidence": "Both kappa(a) and equation (4.6) divide by |y| without an explicit y!=0 hypothesis.",
      "severity": "note",
      "translation_evidence": "The exact sum A is explicitly required to be nonzero."
    }
  ],
  "implications": {
    "lean_implies_paper": {
      "reasoning": "For a paper instance with n>=1, set m=n-1 and use the finite support of its n-1 Bernoulli SR decisions as Omega. Lemma 3.2, the pathwise bounds, and the zero convention provide the D011 fields, so the Lean conclusion specializes exactly to equation (4.6).",
      "verdict": "yes"
    },
    "paper_implies_lean": {
      "reasoning": "The paper's stated Theorem 4.1 concerns actual SR_{p,r} executions. Lean quantifies additional finite error processes satisfying only the sufficient abstract bias model, including processes whose outcomes are not p-bit enclosing-value Bernoulli rounds. The paper statement alone does not assert the bound for that larger class.",
      "verdict": "no"
    }
  },
  "judge_classifications": {
    "direct": "faithful-stronger",
    "roundtrip": "faithful-stronger"
  },
  "rationale": "After direct inspection of the cited PDF pages and the full dependency dossier, the target reproduces the exact relative absolute bias bound with kappa(a), gamma_{n-1}, and u_{p+r}; m is consistently the number of additions, so n=m+1. The finite expectation, recursive order, conditional-bias model, zero convention, and nonzero final sum all match the paper. The only substantive scope difference is favorable: Lean proves the same conclusion for every finite error process satisfying the sufficient model, not solely for Bernoulli SR_{p,r} implementations. Hence Lean implies the paper result, the paper statement does not imply the full generalized Lean proposition, and the correct classification is faithful-stronger.",
  "remaining_uncertainties": [],
  "role": "final-decision",
  "schema_version": "highambench-faithfulness-0.2",
  "task_id": "P17-T2"
}
